{"stamps":{"contract_version":"1.0.0","registry_version":"b9762e99fa2b5f9696b8f21793b9421002a3039de27c28f7373d8857f64f4e26","measurement_source":"statsbomb","source":"statsbomb","season_ids":[27],"season_parquet_sha256":"572ee7948d2fc89a7ff7bea3e6db0abd6308b767f06cf6f9ba58bf79dc82b7f0","percentiles_parquet_sha256":"71dd579ffe7916a7a3ea401a42965d8c2ebb22c0dee12ddd2df27a79deed6003","dna_parquet_sha256":"476bf4fabf14907a2d8fc50f41da63d6371565a072ab2fb2f70c37c9044d5664","positions_parquet_sha256":"a19975bb2bfef9d984eeace3b7c2485690d99c38f1d18a8c3355accd91e1b68e","match_parquet_sha256":"6c97bb09c00046246f956abbe41064655920b0cb272ee7bbc5e2c8ef9b08ac9b","pass_mix_parquet_sha256":"6187aee2b4b59463b96b19b2fc134a142ca9fed98b73fbff103bee9264ad709f"},"group":"CB","families":[{"family":"Aerial","label":"Aerial","definition":"How many aerial duels the player wins per 90: more duels contested and more won both raise it; not the share won.","withheld_short":null,"withheld_full":null},{"family":"Carrying","label":"Carrying & dribbling","definition":"How often the player carries the ball forward and into the final third, per 90: volume, not dribbling success.","withheld_short":null,"withheld_full":null},{"family":"Defending","label":"Defending","definition":null,"withheld_short":"not shown to be free of team-possession effects","withheld_full":"not shown to be free of team-possession effects Defending scores are withheld: these metrics are not shown to be free of team-possession effects. This is not a finding about the player."},{"family":"Passing","label":"Passing","definition":null,"withheld_short":"associated with team possession","withheld_full":"completion vs expected still rises with the team's share of the ball for this position (checked before launch), so no Passing score is shown"},{"family":"Progression","label":"Progressive passing","definition":"How often the player completes passes forward, into the final third and into the box, per 90: counts of completed passes, not the share completed.","withheld_short":null,"withheld_full":null}],"rows":[{"key":"13286-165-7-27","display_name":"Lamine Koné","team_id":165,"team":"Lorient","competition_id":7,"league":"Ligue 1 2015/16","minutes_text":"1620","near_gate":false,"minutes_tiers":["1350"],"scores":{"Aerial":{"score":67.910448,"score_text":"68"},"Carrying":{"score":67.910448,"score_text":"68"},"Progression":{"score":65.920398,"score_text":"66"}}},{"key":"13286-41-2-27","display_name":"Lamine Koné","team_id":41,"team":"Sunderland","competition_id":2,"league":"Premier League 2015/16","minutes_text":"1412","near_gate":true,"minutes_tiers":["1350"],"scores":{"Aerial":{"score":87.288136,"score_text":"87"},"Carrying":{"score":44.067797,"score_text":"44"},"Progression":{"score":43.785311,"score_text":"44"}}},{"key":"3244-29-2-27","display_name":"John Stones","team_id":29,"team":"Everton","competition_id":2,"league":"Premier League 2015/16","minutes_text":"2981","near_gate":false,"minutes_tiers":["1350","1800","2250","2700"],"scores":{"Aerial":{"score":5.932203,"score_text":"6"},"Carrying":{"score":87.288136,"score_text":"87"},"Progression":{"score":74.293785,"score_text":"74"}}},{"key":"3813-22-2-27","display_name":"Wes Morgan","team_id":22,"team":"Leicester City","competition_id":2,"league":"Premier League 2015/16","minutes_text":"3669","near_gate":false,"minutes_tiers":["1350","1800","2250","2700"],"scores":{"Aerial":{"score":38.135593,"score_text":"38"},"Carrying":{"score":6.779661,"score_text":"7"},"Progression":{"score":6.779661,"score_text":"7"}}}],"order":{"Aerial":[1,0,3,2],"Carrying":[2,0,1,3],"Progression":[2,0,1,3]},"default_order":"Aerial","leagues":[{"competition_id":7,"league":"Ligue 1 2015/16"},{"competition_id":2,"league":"Premier League 2015/16"}],"teams":[{"team_id":29,"team":"Everton","competition_id":2},{"team_id":22,"team":"Leicester City","competition_id":2},{"team_id":165,"team":"Lorient","competition_id":7},{"team_id":41,"team":"Sunderland","competition_id":2}],"minutes_tiers":[{"value":"1350","text":"1350+"},{"value":"1800","text":"1800+"},{"value":"2250","text":"2250+"},{"value":"2700","text":"2700+"}]}
