{"stamps":{"contract_version":"1.0.0","registry_version":"b9762e99fa2b5f9696b8f21793b9421002a3039de27c28f7373d8857f64f4e26","measurement_source":"statsbomb","source":"statsbomb","season_ids":[27],"season_parquet_sha256":"572ee7948d2fc89a7ff7bea3e6db0abd6308b767f06cf6f9ba58bf79dc82b7f0","percentiles_parquet_sha256":"71dd579ffe7916a7a3ea401a42965d8c2ebb22c0dee12ddd2df27a79deed6003","dna_parquet_sha256":"476bf4fabf14907a2d8fc50f41da63d6371565a072ab2fb2f70c37c9044d5664","positions_parquet_sha256":"a19975bb2bfef9d984eeace3b7c2485690d99c38f1d18a8c3355accd91e1b68e","match_parquet_sha256":"6c97bb09c00046246f956abbe41064655920b0cb272ee7bbc5e2c8ef9b08ac9b","pass_mix_parquet_sha256":"6187aee2b4b59463b96b19b2fc134a142ca9fed98b73fbff103bee9264ad709f"},"group":"ST","families":[{"family":"Aerial","label":"Aerial","definition":"Mixes two things: how many aerial duels the player wins per 90, and the share of aerial duels won (counted only for players with enough duels). A striker who rarely wins headers scores low even with an average win rate.","withheld_short":null,"withheld_full":null},{"family":"Carrying","label":"Carrying & dribbling","definition":"How often the player carries the ball forward and into the box, per 90: volume, not dribbling success.","withheld_short":null,"withheld_full":null},{"family":"Defending","label":"Defending","definition":null,"withheld_short":"not shown to be free of team-possession effects","withheld_full":"not shown to be free of team-possession effects Defending scores are withheld: these metrics are not shown to be free of team-possession effects. This is not a finding about the player."},{"family":"Goal threat","label":"Goal threat","definition":"How many non-penalty shots the player takes per 90: volume, not finishing.","withheld_short":null,"withheld_full":null},{"family":"Passing","label":"Passing","definition":"The player's open-play pass completion compared with what their mix of short, medium and long passes would predict: accuracy for the length of pass, not difficulty, direction or pressure.","withheld_short":null,"withheld_full":null},{"family":"Progression","label":"Progressive passing","definition":"How often the player completes passes forward, into the final third and into the box, per 90: counts of completed passes, not the share completed.","withheld_short":null,"withheld_full":null}],"rows":[{"key":"19677-220-11-27","display_name":"Karim Benzema","team_id":220,"team":"Real Madrid","competition_id":11,"league":"La Liga 2015/16","minutes_text":"2037","near_gate":false,"minutes_tiers":["1350","1800"],"scores":{"Aerial":{"score":26.190476,"score_text":"26"},"Carrying":{"score":86.904762,"score_text":"87"},"Goal threat":{"score":98.809524,"score_text":"99"},"Passing":{"score":91.666667,"score_text":"92"},"Progression":{"score":92.460317,"score_text":"92"}}},{"key":"3603-30-2-27","display_name":"Mame Diouf","team_id":30,"team":"Stoke City","competition_id":2,"league":"Premier League 2015/16","minutes_text":"1392","near_gate":false,"minutes_tiers":["1350"],"scores":{"Aerial":{"score":52.777778,"score_text":"53"},"Carrying":{"score":30.555556,"score_text":"31"},"Goal threat":{"score":20.833333,"score_text":"21"},"Passing":{"score":68.055556,"score_text":"68"},"Progression":{"score":10.648148,"score_text":"11"}}}],"order":{"Aerial":[1,0],"Carrying":[0,1],"Goal threat":[0,1],"Passing":[0,1],"Progression":[0,1]},"default_order":"Goal threat","leagues":[{"competition_id":11,"league":"La Liga 2015/16"},{"competition_id":2,"league":"Premier League 2015/16"}],"teams":[{"team_id":220,"team":"Real Madrid","competition_id":11},{"team_id":30,"team":"Stoke City","competition_id":2}],"minutes_tiers":[{"value":"1350","text":"1350+"},{"value":"1800","text":"1800+"},{"value":"2250","text":"2250+"},{"value":"2700","text":"2700+"}]}
