{"stamps":{"contract_version":"1.0.0","registry_version":"b9762e99fa2b5f9696b8f21793b9421002a3039de27c28f7373d8857f64f4e26","measurement_source":"statsbomb","source":"statsbomb","season_ids":[27],"season_parquet_sha256":"572ee7948d2fc89a7ff7bea3e6db0abd6308b767f06cf6f9ba58bf79dc82b7f0","percentiles_parquet_sha256":"71dd579ffe7916a7a3ea401a42965d8c2ebb22c0dee12ddd2df27a79deed6003","dna_parquet_sha256":"476bf4fabf14907a2d8fc50f41da63d6371565a072ab2fb2f70c37c9044d5664","positions_parquet_sha256":"a19975bb2bfef9d984eeace3b7c2485690d99c38f1d18a8c3355accd91e1b68e","match_parquet_sha256":"6c97bb09c00046246f956abbe41064655920b0cb272ee7bbc5e2c8ef9b08ac9b","pass_mix_parquet_sha256":"6187aee2b4b59463b96b19b2fc134a142ca9fed98b73fbff103bee9264ad709f"},"group":"FB-WB","families":[{"family":"Aerial","label":"Aerial","definition":"How many aerial duels the player wins per 90: more duels contested and more won both raise it; not the share won.","withheld_short":null,"withheld_full":null},{"family":"Carrying","label":"Carrying & dribbling","definition":"How often the player carries the ball forward and into the box, per 90: volume, not dribbling success.","withheld_short":null,"withheld_full":null},{"family":"Creation","label":"Creation","definition":"How many open-play passes per 90 lead to a shot: volume of chances made, not their quality.","withheld_short":null,"withheld_full":null},{"family":"Defending","label":"Defending","definition":null,"withheld_short":"not shown to be free of team-possession effects","withheld_full":"not shown to be free of team-possession effects Defending scores are withheld: these metrics are not shown to be free of team-possession effects. This is not a finding about the player."},{"family":"Goal threat","label":"Goal threat","definition":"How many non-penalty shots the player takes per 90: volume, not finishing.","withheld_short":null,"withheld_full":null},{"family":"Passing","label":"Passing","definition":null,"withheld_short":"associated with team possession","withheld_full":"completion vs expected still rises with the team's share of the ball for this position (checked before launch), so no Passing score is shown"},{"family":"Progression","label":"Progressive passing","definition":"How often the player completes passes forward and into the box, per 90: counts of completed passes, not the share completed.","withheld_short":null,"withheld_full":null}],"rows":[{"key":"3052-36-2-27","display_name":"Pablo Zabaleta","team_id":36,"team":"Manchester City","competition_id":2,"league":"Premier League 2015/16","minutes_text":"1131","near_gate":true,"minutes_tiers":[],"scores":{"Aerial":{"score":57.758621,"score_text":"58"},"Carrying":{"score":50.0,"score_text":"50"},"Creation":{"score":0.862069,"score_text":"1"},"Goal threat":{"score":18.103448,"score_text":"18"},"Progression":{"score":32.758621,"score_text":"33"}}}],"order":{"Aerial":[0],"Carrying":[0],"Creation":[0],"Goal threat":[0],"Progression":[0]},"default_order":"Progression","leagues":[{"competition_id":2,"league":"Premier League 2015/16"}],"teams":[{"team_id":36,"team":"Manchester City","competition_id":2}],"minutes_tiers":[{"value":"1350","text":"1350+"},{"value":"1800","text":"1800+"},{"value":"2250","text":"2250+"},{"value":"2700","text":"2700+"}]}
